69,5/14/2025,Capstone,Playtesting I,Feedback drives iteration.,How do we gather feedback effectively?,Students will conduct structured playtests.,45m playtest; 15m feedback; 30m revisions,Playtest rubric,Builds,Peer feedback forms,CFU peer form,Playtest log,Advanced: external testers,Scaffold peer review,ISTE 5
70,5/15/2025,Capstone,Playtesting II,Iteration strengthens design.,How do we revise from feedback?,Students will revise builds & log changes.,45m lab; 15m quiz; 30m devlog update,Revision guide,Unity project,N/A,Quiz,Revisions logged,Extension: video devlog,Scaffold devlog template,ISTE 5
71,5/18/2025,Capstone,Portfolio Prep I,Portfolios showcase growth.,How can we highlight our best work?,Students will select artifacts for portfolio.,45m portfolio slides; 15m CFU; 30m artifact curation,Portfolio guide,Student work,GitHub Pages,Exit ticket,Artifact list,Extension: custom site design,Scaffold artifact checklist,"ISTE 1, 5"
72,5/19/2025,Capstone,Portfolio Prep II,Reflection strengthens identity.,How do we reflect on our learning?,Students will draft reflection essays.,45m writing workshop; 15m peer share; 30m revision,Reflection guide,Writing template,GitHub Pages,CFU peer review,Reflection drafts,Advanced: video reflections,Scaffold sentence starters,NGLS ELA.W
73,5/20/2025,Capstone,Portfolio Build I,Presentation communicates skill.,How do we build a digital portfolio?,Students will build GitHub Pages portfolio.,45m demo; 15m CFU; 30m build,GitHub guide,GitHub repo,GitHub Pages docs,Exit ticket,Portfolio skeleton,Extension: custom CSS,Scaffold starter template,ISTE 6
74,5/21/2025,Capstone,Portfolio Build II,Design improves clarity.,How do we structure a portfolio?,"Students will add projects, reflections.",45m demo; 15m quiz; 30m lab,Slides,GitHub repo,GitHub Pages docs,Quiz,Portfolio populated,Extension: site polish,Scaffold site checklist,ISTE 6
75,5/22/2025,Capstone,Portfolio Build III,Portfolios evolve iteratively.,How do we refine portfolios?,Students will polish portfolio layout.,45m demo; 15m CFU; 30m lab,Portfolio polish slides,GitHub repo,GitHub Pages,CFU peer review,Polished portfolio,Extension: custom domain,Scaffold peer guide,ISTE 6
76,5/25/2025,—,Memorial Day,Schools closed,—,—,—,—,—,—,—,—,—,—,
77,5/26/2025,Capstone,Final Debugging I,Debugging ensures readiness.,How do we eliminate final bugs?,Students will debug final builds.,45m lab; 15m CFU; 30m bug fix,Debugging guide,Unity project,N/A,CFU bug log,Debug log,Scaffold debug steps,ISTE 5,
78,5/27/2025,Capstone,Final Debugging II,Testing ensures quality.,How do we polish for release?,Students will refine builds.,45m lab; 15m quiz; 30m revisions,Debug slides,Unity project,Docs,Quiz,Final build ready,Extension: beta release,Scaffold peer test,ISTE 5
79,5/28/2025,Capstone,Final Polish I,Polish enhances experience.,How do we refine UI/UX polish?,"Students will refine menus, art, sounds.",45m lab polish; 15m quiz; 30m showcase prep,Polish checklist,Unity project,Docs,Quiz,Final polish log,Extension: shader polish,Scaffold starter,ISTE 6
80,5/29/2025,Capstone,Final Polish II,Iteration improves quality.,How do we finalize builds?,Students will lock features.,45m lab; 15m CFU; 30m finalize,Slides,Unity project,Docs,Exit ticket,Feature freeze,Extension: trailer video,Scaffold feature list,ISTE 6
81,6/1/2025,Showcase Prep,Trailer & Marketing,Presentation promotes work.,How do we market our games?,Students will create trailers.,45m trailer demo; 15m CFU; 30m edit trailer,Trailer guide,Video editor,N/A,CFU storyboard,Trailer created,Extension: poster,Scaffold template,ISTE 6
82,6/2/2025,Showcase Prep,Pitch Practice,Pitches communicate vision.,How do we pitch games effectively?,Students will practice oral pitches.,45m pitch workshop; 15m quiz; 30m practice,Pitch slides,Pitch script,N/A,Quiz,Pitch draft,Extension: live Q&A prep,Scaffold pitch starter,ISTE 4
83,6/3/2025,Showcase Prep,Dress Rehearsal,Practice builds confidence.,How do we prepare for showcase?,Students will rehearse with peers.,45m rehearsal; 15m CFU; 30m revisions,Rehearsal guide,Builds,N/A,CFU peer feedback,Rehearsal complete,Scaffold peer notes,"ISTE 1, 4",
84,6/4/2025,—,Chancellor’s Conference Day,Schools closed,—,—,—,—,—,—,—,—,—,—,
85,6/5/2025,—,Clerical Day,Schools closed,—,—,—,—,—,—,—,—,—,—,—
86,6/6/2025,Final Portfolio,Portfolio Due,Reflection showcases learning.,How can we demonstrate growth?,Students will finalize & submit portfolios.,45m check-in; 45m submissions,Portfolio rubric,GitHub repo,GitHub Pages,CFU submission check,Portfolio graded,Scaffold checklist,"ISTE 1, 5",
87,6/9/2025,Final Showcase,Showcase Day I,Sharing demonstrates mastery.,How do we share games effectively?,Students will present projects.,90m presentations,Showcase rubric,Builds & portfolios,N/A,Peer evals,Showcase graded,Scaffold rubric,"ISTE 1, 4",
88,6/10/2025,Final Showcase,Showcase Day II,Reflection enhances growth.,How do we reflect on feedback?,Students will continue presentations.,90m presentations,Showcase rubric,Builds & portfolios,N/A,Peer evals,Showcase graded,Scaffold rubric,"ISTE 1, 4",
89,6/17/2025,Reflection,Final Reflection I,Reflection deepens understanding.,What skills have I mastered?,Students will write reflection essays.,45m writing; 45m peer share,Reflection prompts,Template,N/A,Exit ticket,Reflection essay,Scaffold sentence starters,NGLS ELA.W,
90,6/18/2025,Reflection,Final Reflection II,Reflection prepares for future.,How do we transfer skills forward?,Students will create future learning plan.,45m plan writing; 45m discussion,Future skills guide,Template,N/A,CFU discussion,Final plan submitted,Scaffold prompts,ISTE 1,